Tamil_Issues,Tamil_Solutions
பணிச்சுமை,தொடர்ந்து வேலை செய்யவோ படிக்கவோ வேண்டாம். ஒவ்வொரு 40 நிமிடங்களுக்கும் சில சிறிய இடைவெளிகளை எடுத்துக் கொள்ளுங்கள். நல்ல இசையைக் கேளுங்கள்
வேலைப்பளு,தொடர்ந்து வேலை செய்யவோ படிக்கவோ வேண்டாம். ஒவ்வொரு 40 நிமிடங்களுக்கும் சில சிறிய இடைவெளிகளை எடுத்துக் கொள்ளுங்கள். நல்ல இசையைக் கேளுங்கள்
கல்வி,உங்கள் சந்தேகங்களை தெளிவுபடுத்த தயங்காதீர்கள். உங்களால் உங்கள் விரிவுரையாளர்களிடம் கேட்க முடியவில்லை என்றால் உங்கள் நண்பர்களிடம் கேளுங்கள். குழு ஆய்வுகள் உங்களுக்கு உதவும்.
வருகை,பல்கலைக்கழக நிர்வாகம் மற்றும் விரிவுரையாளர்களுடன் கலந்துரையாடுங்கள். பல்கலைக்கழக கால அட்டவணையின்படி உங்கள் மற்ற வேலைகளை திட்டமிடுங்கள்
சமர்ப்பிப்பு,வேலை அல்லது உடற்பயிற்சி செய்ய உங்கள் நேரத்தை திட்டமிட்டு திட்டமிடுங்கள். நீங்கள் படிக்கும் போது சில குறிப்புகளை தயார் செய்யுங்கள். பீதியடைய வேண்டாம். சமர்ப்பிப்பதற்கான நினைவூட்டல்களைச் சேர்க்கவும். உங்கள் விரிவுரையாளர்களிடம் பேசுங்கள்.
மதிப்பெண்கள்,"காரணங்கள் மற்றும் பலவீனமான அத்தியாயங்கள் அல்லது தொகுதிகளை அடையாளம் காணவும். குறிப்புகளை தயார் செய்து சந்தேகங்களை நிவர்த்தி செய்யவும். புத்தகங்கள், பயிற்சிகள் அல்லது ஆன்லைன் படிப்புகளைப் பார்க்கவும்"
கவனம்,"புதிர், சதுரங்கம் மற்றும் ஸ்கிராம்பிள் போன்ற சில மூளை விளையாட்டுகளை விளையாடுங்கள். ஒவ்வொரு நாளும், 15 முதல் 20 நிமிடங்கள் கூட வெளியில் செல்ல முயற்சி செய்யுங்கள். நீங்கள் ஒரு பூங்கா வழியாக ஒரு சிறிய நடைப்பயணத்தை மேற்கொள்ளலாம். உங்கள் தோட்டத்திலோ அல்லது கொல்லைப்புறத்திலோ உட்கார்ந்து கொள்ளலாம். எந்த இயற்கை சூழலும் பொருத்தமானது"
படிப்பு பிடிக்கவில்லை,"எது உங்களை மகிழ்ச்சியடையச் செய்கிறது என்பதைக் கண்டறியவும். மக்களிடம் பேசுங்கள். சூழலுக்கு ஏற்ப சிறிது நேரம் கொடுங்கள். உங்களுக்கு இன்னும் சிக்கல் இருந்தால், பாடநெறி உங்களுக்கு சரியானதா அல்லது மாற்ற விரும்புகிறீர்களா என்பதைத் தீர்மானிக்கவும். உங்கள் பல்கலைக்கழகத்தை தொடர்பு கொள்ளவும்."
பல்கலைக்கழகம் பிடிக்கவில்லை,"எது உங்களை மகிழ்ச்சியடையச் செய்கிறது என்பதைக் கண்டறியவும். மக்களிடம் பேசுங்கள். சூழலுக்கு ஏற்ப சிறிது நேரம் கொடுங்கள். உங்களுக்கு இன்னும் சிக்கல் இருந்தால், பாடநெறி உங்களுக்கு சரியானதா அல்லது மாற்ற விரும்புகிறீர்களா என்பதைத் தீர்மானிக்கவும். உங்கள் பல்கலைக்கழகத்தை தொடர்பு கொள்ளவும்."
பகிடிவதை,பீதியடைய வேண்டாம். பகிடிவதையை விளையாட்டாக எடுத்து மகிழுங்கள். வரம்புக்கு அப்பாற்பட்டதாக இருந்தால் புகார் அளிக்கவும்.
விரிவுரைகள்,"சில ஊக்கமளிக்கும் பேச்சுகளைப் பாருங்கள். உங்கள் இலக்கை அமைக்கவும். உங்கள் விரிவுரையாளர், நண்பர்கள் மற்றும் மூத்தவர்களின் உதவியுடன் தெளிவற்ற தலைப்புகளைப் புரிந்துகொள்ள முயற்சிக்கவும். குழு ஆய்வு உங்களுக்கு மிகவும் உதவும்."
தொடர்பாடல்,மொழி என்பது தொடர்பு கொள்ள ஒரு ஊடகம் மட்டுமே. மற்றவர்களுடன் தொடர்பு கொள்ள பயப்பட வேண்டாம். தொடர்ந்து பயிற்சி செய்யுங்கள். உங்கள் ஓய்வு நேரத்தில் குறிப்பிட்ட மொழியில் சில திரைப்படங்களைப் பாருங்கள் அல்லது சில பாடல்களைக் கேளுங்கள்.
மொழி,மொழி என்பது தொடர்பு கொள்ள ஒரு ஊடகம் மட்டுமே. மற்றவர்களுடன் தொடர்பு கொள்ள பயப்பட வேண்டாம். தொடர்ந்து பயிற்சி செய்யுங்கள். உங்கள் ஓய்வு நேரத்தில் குறிப்பிட்ட மொழியில் சில திரைப்படங்களைப் பாருங்கள் அல்லது சில பாடல்களைக் கேளுங்கள்.
ஆங்கிலம்,"உங்கள் நண்பர்கள் அல்லது உங்கள் குடும்ப உறுப்பினர்களுடன் ஆங்கிலத்தில் பேசுங்கள். தொடர்ந்து ஆங்கிலத்தில் பேசுவது சரளமாக பேச உதவுகிறது. ஆங்கிலத் திரைப்படங்கள் மற்றும் கார்ட்டூன்களைப் பார்த்து, ஓய்வு நேரத்தில் சில பாடல்களைக் கேளுங்கள்."
பயம்,நீங்கள் எப்படி உணருகிறீர்கள் என்பதில் உண்மையாக இருங்கள். உங்கள் நோக்கங்களில் விழிப்புடன் இருங்கள். நேர்மறை எண்ணங்களில் கவனம் செலுத்துங்கள். மூச்சுப் பயிற்சி உங்களுக்கு உதவும்
நோய்கள்,உங்கள் ஆரோக்கியத்தை மேம்படுத்த சாப்பிட மற்றும் குடிக்கவும். தொடர்ந்து உடற்பயிற்சி செய்யுங்கள். தளர்வு நுட்பங்களைப் படித்து பயிற்சி செய்யுங்கள்.
மன அழுத்தம்,ஓய்வு அல்லது நண்பர்களுடன் நேரத்தை செலவிடுவது போன்ற நீங்கள் அனுபவிக்கும் செயல்பாடுகளுடன் பள்ளிப் பாடங்கள் போன்ற பொறுப்புகளை சமநிலைப்படுத்துங்கள். இது சமநிலையைப் பற்றியது: எல்லா வேலையும் எந்த விளையாட்டும் மோசமாக இல்லை. தினமும் உடற்பயிற்சி செய்ய நேரம் ஒதுக்குங்கள். சரியான தூக்கம் கிடைக்கும். அனிமேஷனைப் பார்ப்பதும் மன அழுத்தத்தைக் குறைக்க ஒரு நல்ல வழியாகும். தோட்டக்கலை போன்ற நிதானமான பொழுதுபோக்கைக் கண்டறிதல்.
மனச்சோர்வு,தொடர்ந்து உடற்பயிற்சி செய்யுங்கள். இது உங்களை தற்காலிகமாக உயர்த்துகிறது. போதுமான அளவு உறங்கு. ஆரோக்கியமாக சாப்பிடுங்கள். மதுசாரம் மற்றும் பிற போதைப்பொருட்களை தவிர்க்கவும். நிதானமான பொழுதுபோக்கைக் கண்டறிதல்
பொருளாதார,பணம் தொடர்பான மன அழுத்தத்தை நீங்கள் எவ்வாறு எதிர்கொள்கிறீர்கள் என்பதை அறிந்து கொள்ளுங்கள். சலனத்தைத் தவிர்க்கவும். முக்கியமானதை நினைவில் வையுங்கள். ஆதரவைக் கேளுங்கள். சரியான தூக்கம் கிடைக்கும். நல்ல இசையைக் கேளுங்கள்.
வருமானம்,பணம் தொடர்பான மன அழுத்தத்தை நீங்கள் எவ்வாறு எதிர்கொள்கிறீர்கள் என்பதை அறிந்து கொள்ளுங்கள். சலனத்தைத் தவிர்க்கவும். முக்கியமானதை நினைவில் வையுங்கள். ஆதரவைக் கேளுங்கள். சரியான தூக்கம் கிடைக்கும். நல்ல இசையைக் கேளுங்கள்.
பணம்,பணம் தொடர்பான மன அழுத்தத்தை நீங்கள் எவ்வாறு எதிர்கொள்கிறீர்கள் என்பதை அறிந்து கொள்ளுங்கள். சலனத்தைத் தவிர்க்கவும். முக்கியமானதை நினைவில் வையுங்கள். ஆதரவைக் கேளுங்கள். சரியான தூக்கம் கிடைக்கும். நல்ல இசையைக் கேளுங்கள்.
ஏழ்மை ,பணம் தொடர்பான மன அழுத்தத்தை நீங்கள் எவ்வாறு எதிர்கொள்கிறீர்கள் என்பதை அறிந்து கொள்ளுங்கள். சலனத்தைத் தவிர்க்கவும். முக்கியமானதை நினைவில் வையுங்கள். ஆதரவைக் கேளுங்கள். சரியான தூக்கம் கிடைக்கும். நல்ல இசையைக் கேளுங்கள்.
வறுமை,பணம் தொடர்பான மன அழுத்தத்தை நீங்கள் எவ்வாறு எதிர்கொள்கிறீர்கள் என்பதை அறிந்து கொள்ளுங்கள். சலனத்தைத் தவிர்க்கவும். முக்கியமானதை நினைவில் வையுங்கள். ஆதரவைக் கேளுங்கள். சரியான தூக்கம் கிடைக்கும். நல்ல இசையைக் கேளுங்கள்.
கோபம்,"பேசுவதற்கு முன் யோசி. நீங்கள் அமைதியாக உணர்ந்தால், உங்கள் கவலைகளை வெளிப்படுத்துங்கள். உரிய நேரம் எடுத்துக்கொள்ளுங்கள். பதற்றத்தை விடுவிக்க நகைச்சுவையைப் பயன்படுத்துங்கள். கார்ட்டூன்கள் அல்லது நகைச்சுவை வீடியோக்களைப் பாருங்கள். யோகா அல்லது சுவாசப் பயிற்சிகளைச் செய்யுங்கள்"
உணர்வுகளை மறைக்கிறேன்,உங்கள் உணர்வுகளை நேர்மையாக பகிர்ந்து கொள்ளுங்கள். நீங்கள் நம்பும் ஒருவரிடம் பேசுங்கள். உங்களை நன்றாக உணர சிரிக்கவும். ஒரு கண்ணாடியைக் கண்டுபிடித்து அதை வேடிக்கையாக்குங்கள். மூச்சுப் பயிற்சி செய்யுங்கள்.
தனிமை,உங்களுக்கு மகிழ்ச்சியைத் தரும் அனைத்து விஷயங்களையும் செய்யுங்கள். உங்களால் முடிந்தால் உங்கள் குடும்பத்தினர் அல்லது நண்பர்களுடன் பழகவும். புதியவர்களைச் சந்தித்து அவர்களுடன் நட்பாக இருங்கள். குறைந்த தனிமையை உணர ஒரு தன்னார்வ வாய்ப்பைக் கண்டறியவும். தனிப்பட்ட தொடர்புகளுடன் தனிமையைக் கடக்க உங்கள் பல்கலைக்கழக கிளப்பில் சேரவும்
ஓய்வில்லை ,உங்கள் நேரத்தை நிர்வகிக்கவும். உங்கள் செயல்பாடுகளுக்கு முன்னுரிமை கொடுப்பது உங்கள் நேரத்தை நன்றாகப் பயன்படுத்த உதவும். உங்களுக்காக நேரத்தை ஒதுக்குங்கள். மெல்லிசையைக் கேளுங்கள்
சுதந்திரம்,எப்போதும் தன்னார்வலராக இருங்கள். உங்கள் பல்கலைக்கழகத்தில் நியாயமான வர்த்தகத்தில் பங்கேற்கவும். மற்றவர்களின் கதைகளைக் கேளுங்கள். சமூக இயக்கங்களுடன் இணைந்திருங்கள்
பிரச்சனைகளை மறைக்கிறேன்,"ஊக்கமளிக்கும் பேச்சைப் பாருங்கள், நீங்கள் நம்பும் ஒருவருடன் பேசுங்கள். உங்கள் உணர்வுகளை நேர்மையாக பகிர்ந்து கொள்ளுங்கள்"
கூச்சம்,"கண் தொடர்பு, நம்பிக்கையான உடல் மொழி, அறிமுகங்கள், சிறிய பேச்சு, கேள்விகள் கேட்பது மற்றும் நீங்கள் மிகவும் வசதியாக இருக்கும் நபர்களுடன் அழைப்புகள் போன்ற சமூக நடத்தைகளைப் பயிற்சி செய்யுங்கள். புன்னகை. என்ன சொல்ல வேண்டும் என்று ஒத்திகை பார்க்கவும்."
வெட்கம் ,"கண் தொடர்பு, நம்பிக்கையான உடல் மொழி, அறிமுகங்கள், சிறிய பேச்சு, கேள்விகள் கேட்பது மற்றும் நீங்கள் மிகவும் வசதியாக இருக்கும் நபர்களுடன் அழைப்புகள் போன்ற சமூக நடத்தைகளைப் பயிற்சி செய்யுங்கள். புன்னகை. என்ன சொல்ல வேண்டும் என்று ஒத்திகை பார்க்கவும்."
பாதுகாப்பு,உங்கள் உணர்வுகளைத் தவிர்ப்பதற்குப் பதிலாக அவற்றை எதிர்கொள்ளுங்கள். பின்னடைவுகளுக்கு உங்களை தயார்படுத்துங்கள் ஆனால் அவர்கள் உங்களை கட்டுப்படுத்த அனுமதிக்காதீர்கள். உங்கள் குணாதிசயங்கள் மற்றும் உணர்வுகள் அனைத்தையும் ஏற்றுக்கொள்ளுங்கள். உங்கள் எதிர்மறை எண்ணங்களை சவால் செய்து விமர்சன ரீதியாக சிந்திக்கவும்.
பதட்டம்,சூழ்நிலையை எதிர்கொள்ளுங்கள். அமைதியாய் இருங்கள். ஆழ்ந்த மூச்சு விடுங்கள். நீங்கள் கற்றுக்கொண்டதைக் கருத்தில் கொள்ளுங்கள். சிரிக்கவும்
பதற்றம்,சூழ்நிலையை எதிர்கொள்ளுங்கள். அமைதியாய் இருங்கள். ஆழ்ந்த மூச்சு விடுங்கள். நீங்கள் கற்றுக்கொண்டதைக் கருத்தில் கொள்ளுங்கள். சிரிக்கவும்
முறைகேடு,உங்கள் குடும்பத்தினருடன் பேசுங்கள். உங்கள் விரிவுரையாளர்கள் அல்லது பல்கலைக்கழக நிர்வாகங்களுக்கு தெரிவிக்கவும். ஒரு நிலைப்பாட்டை எடு. தொடர்ந்து யோகா மற்றும் உடற்பயிற்சி செய்யுங்கள்.
துஷ்பிரயோகம்,உங்கள் குடும்பத்தினருடன் பேசுங்கள். உங்கள் விரிவுரையாளர்கள் அல்லது பல்கலைக்கழக நிர்வாகங்களுக்கு தெரிவிக்கவும். ஒரு நிலைப்பாட்டை எடு. தொடர்ந்து யோகா மற்றும் உடற்பயிற்சி செய்யுங்கள்.
தொந்தரவு,உங்கள் குடும்பத்தினருடன் பேசுங்கள். உங்கள் விரிவுரையாளர்கள் அல்லது பல்கலைக்கழக நிர்வாகங்களுக்கு தெரிவிக்கவும். ஒரு நிலைப்பாட்டை எடு. தொடர்ந்து யோகா மற்றும் உடற்பயிற்சி செய்யுங்கள்.
தொல்லை,உங்கள் குடும்பத்தினருடன் பேசுங்கள். உங்கள் விரிவுரையாளர்கள் அல்லது பல்கலைக்கழக நிர்வாகங்களுக்கு தெரிவிக்கவும். ஒரு நிலைப்பாட்டை எடு. தொடர்ந்து யோகா மற்றும் உடற்பயிற்சி செய்யுங்கள்.
துன்புறுத்தல் ,உங்கள் குடும்பத்தினருடன் பேசுங்கள். உங்கள் விரிவுரையாளர்கள் அல்லது பல்கலைக்கழக நிர்வாகங்களுக்கு தெரிவிக்கவும். ஒரு நிலைப்பாட்டை எடு. தொடர்ந்து யோகா மற்றும் உடற்பயிற்சி செய்யுங்கள்.
சித்திரவதை,உங்கள் குடும்பத்தினருடன் பேசுங்கள். உங்கள் விரிவுரையாளர்கள் அல்லது பல்கலைக்கழக நிர்வாகங்களுக்கு தெரிவிக்கவும். ஒரு நிலைப்பாட்டை எடு. தொடர்ந்து யோகா மற்றும் உடற்பயிற்சி செய்யுங்கள்.
இறப்பு,இழப்பின் உணர்வுகளைப் புரிந்துகொள்ளக்கூடிய உறவினர்கள் மற்றும் நண்பர்களைக் கண்டறியவும். நடந்தவற்றை ஏற்றுக்கொள்ளுங்கள். பொய்யான ஆறுதல் கூறாதீர்கள். உங்கள் ஆரோக்கியத்தை கவனித்துக் கொள்ளுங்கள். ஆரோக்கியமான உணவை உண்ணுங்கள். உடற்பயிற்சி மற்றும் யோகா உங்களுக்கு உதவும்.
இழப்பு ,இழப்பின் உணர்வுகளைப் புரிந்துகொள்ளக்கூடிய உறவினர்கள் மற்றும் நண்பர்களைக் கண்டறியவும். நடந்தவற்றை ஏற்றுக்கொள்ளுங்கள். பொய்யான ஆறுதல் கூறாதீர்கள். உங்கள் ஆரோக்கியத்தை கவனித்துக் கொள்ளுங்கள். ஆரோக்கியமான உணவை உண்ணுங்கள். உடற்பயிற்சி மற்றும் யோகா உங்களுக்கு உதவும்.
